{
  "schemaVersion": 1,
  "exportedAt": null,
  "projects": [
    {
      "id": "habit-haunt",
      "name": "HabitHaunt",
      "description": "A habit tracker with gentle streaks and weekly reflections.",
      "goal": "Make habits feel gentle. Streaks that forgive, a Sunday reflection, nothing that shouts.",
      "status": "Dead",
      "cause": "Scope creep",
      "progress": 62,
      "tags": [
        "mobile",
        "habits",
        "react"
      ],
      "completed": [
        "Auth and onboarding",
        "Habit CRUD",
        "Streak calculation",
        "Dark mode"
      ],
      "unfinished": [
        "Streak card UI",
        "Cloud sync",
        "Push reminders",
        "Home-screen widget"
      ],
      "created": "2026-03-24",
      "lastActive": "2026-03-24",
      "notes": []
    },
    {
      "id": "recipe-rot",
      "name": "RecipeRot",
      "description": "A recipe manager that was meant to make weeknight cooking less chaotic.",
      "goal": "Help people cook with what they already have.",
      "status": "Dormant",
      "cause": "Lost interest",
      "progress": 40,
      "tags": [
        "food",
        "design",
        "search"
      ],
      "completed": [
        "Recipe editor",
        "Ingredient list",
        "Basic search"
      ],
      "unfinished": [
        "Pantry matching",
        "Shopping list",
        "Mobile layout"
      ],
      "created": "2026-06-15",
      "lastActive": "2026-06-15",
      "notes": []
    },
    {
      "id": "pixel-pantry",
      "name": "PixelPantry",
      "description": "A pixel-art inventory game for collecting tiny treasures.",
      "goal": "Make inventory management feel like finding a secret room.",
      "status": "Dead",
      "cause": "No time",
      "progress": 25,
      "tags": [
        "game",
        "pixel-art"
      ],
      "completed": [
        "Pixel palette",
        "Item schema"
      ],
      "unfinished": [
        "Sprite sheet",
        "Save system",
        "Inventory interactions"
      ],
      "created": "2025-09-18",
      "lastActive": "2025-09-18",
      "notes": []
    },
    {
      "id": "note-necro",
      "name": "NoteNecro",
      "description": "Markdown notes with sync, tags and a search that remembers.",
      "goal": "A quiet home for notes that works the way my brain does.",
      "status": "Resurrecting",
      "cause": "Tech blocker",
      "progress": 80,
      "tags": [
        "notes",
        "markdown"
      ],
      "completed": [
        "Markdown editor",
        "Local save",
        "Tags"
      ],
      "unfinished": [
        "Sync",
        "Search",
        "Import/export"
      ],
      "created": "2026-07-02",
      "lastActive": "2026-07-02",
      "notes": []
    }
  ],
  "salvage": [],
  "adoptionDrafts": []
}